{
  "chapter_index": 12,
  "logic_score": 88,
  "character_score": 92,
  "pace_score": 90,
  "information_score": 91,
  "emotion_score": 93,
  "style_score": 94,
  "hook_score": 92,
  "total_score": 91,
  "major_conflict": false,
  "needs_rewrite": true,
  "needs_manual_review": false,
  "problems": [
    "整体完成度高，基本命中章节任务，但存在一处信息可信度偏弱：从会议放出试点到闪奔到家精准带着“赔付重算”话术堵门，反应速度过快，容易让读者感觉信息泄露过于方便，需补一笔他们为何能这么快得知并定向出击。",
    "董事会态度变化有呈现，但“观望派”具体是谁、为什么松动仍稍泛，当前更像功能性放行，缺少一两个带现实考量的细节支点，导致内部权力变化略轻。",
    "韩啸的反对总体合格，但还可以再加一层他对试点失败后连锁风险的具体担忧，例如财务确认口径、客服审核人力、其他站点跟进效仿，以增强反派的专业性和阻力厚度。",
    "陆川推动规则试点的成长转折已经成立，但他从‘拿账去吵’到能迅速接住苏蔓的制度表达，略显顺滑，可补一笔他对试点边界、周期、验证指标的现实顾虑，让成长显得更像被逼着学会，而不是自然就会。",
    "异常单责任拆分机制写得清楚，但执行层面的可操作性还可再落一格，例如谁先判定、多久反馈、申诉不过如何处理，否则后续若不承接，读者会觉得本章方案偏会议化。",
    "结尾钩子强，但‘打印店热墨味宣传页’与‘不到半小时就成套到位’强化了对手有备而来的感觉，这本身可用，但若后文短期内不解释，会提前放大内鬼线嫌疑，和本章避免过重展开内鬼线的要求有轻微摩擦。"
  ],
  "rewrite_instruction": "保留本章主体结构与台词风格，不重写剧情走向，做定点增强：1）在结尾挖角段前后补1-2句合理化信息来源，例如站点群消息外泄、竞争对手长期盯老周站点、试点消息在行业群扩散，避免‘半小时精准堵门’显得生硬；2）给董事会观望派增加一个具体表态理由，如某董事认为运力流失成本已高于短期报表波动，让态度转变更可信；3）强化韩啸的现实阻力，再补一句制度试点会牵动审核成本、财务确认和全网跟风申诉风险，避免他只像站在报表一边；4）给陆川加一小段对试点边界和验证标准的主动确认，如两周看履约、申诉通过率、站点净损变化，体现他开始学会‘立规矩’而非只会怼人；5）把异常单责任拆分与申诉直通机制的执行流程再落细半步，至少说明谁收口、多久反馈、证据不全怎么处理；6）控制内鬼暗示强度，不要直接写成明显泄密，可维持‘对手一直盯着老周站点’的商业竞争压迫感。"
}