{
  "chapter_index": 8,
  "logic_score": 88,
  "character_score": 92,
  "pace_score": 90,
  "information_score": 91,
  "emotion_score": 89,
  "style_score": 93,
  "hook_score": 90,
  "total_score": 90,
  "major_conflict": false,
  "needs_rewrite": false,
  "needs_manual_review": true,
  "problems": [
    "整体完成度高，基本命中章节任务，且无重大设定冲突。",
    "韩啸在门店现场仍试图讲整段官方口径，功能上成立，但略显过于配合主角打脸，容易让角色专业性稍弱；建议补一两句更具体的风险考量，让他的管理逻辑更完整。",
    "陆川当众直接说“现在不是个案，是链条断了”“是我们送得烂”，戏剧效果强，但从公司治理与法务风险看偏冒进；虽然后文有苏蔓补边界，但仍建议稍微收束措辞，避免主角显得不顾后果。",
    "白名单先保六家门店的方案合理，但当前文本对‘为什么是六家而不是九家核心店全保’解释还可再具体一点，例如按时段峰值、客单密度、差评外溢性筛选，以增强业务可信度。",
    "赵姐从强硬到给一晚观察期的转折基本顺，但略快；可增加一个触发点，例如她看到陆川主动承认‘只能先止血不能根治’后态度松动，以让信任变化更扎实。",
    "章节尾部已成功搭桥下一章，但‘今晚具体怎么落人、谁对接哪个部门’还停留在口头调度层，若能再补一个非常小的执行钉子，例如先拉群、先定第一接口人姓名，会更有落地感。",
    "信息增量足够，但客服链条、赔付链条为何会瘫成这样尚未给出哪怕轻微指向，作为后续系统线伏笔可以再埋一针，让本章不只停在表层止血。"
  ],
  "rewrite_instruction": "本章不需要推倒重写，做一轮中度精修即可。给Kimi的修订指令：1）保留现有结构、场景和主要对话，不改章节结论。2）增强韩啸的专业性，在他控口径时补一句更具体的顾虑，例如商户截图外传、统一承诺失控、区域连锁索赔扩散，避免其沦为纯话术反派。3）把陆川当众承认问题的表述微调得更像‘承认现场失控、拒绝空话’，少一点可被理解为代表公司全面定性的失言，保住人物真实但不莽撞。4）补强白名单筛选逻辑，明确六家优先门店的选择依据：午晚高峰峰值、写字楼时效敏感、医院/社区投诉外溢、夜宵单复购高等。5）把赵姐态度松动的触发动作再写实一点，突出她不是被说服，而是因为陆川不画饼、肯限定范围、肯给责任人，才勉强给观察期。6）在车内布置方案时，补一个立即执行的落地细节，例如当场拉群、指定第一接口人、要求十分钟首轮回传，增强‘今晚就开干’的执行感。7）可顺手埋一丝后续伏笔：客服、调度、赔付之间不是单纯忙不过来，而是接口断裂、流程失真或有人把责任链做散，为后续系统问题升级留痕。"
}