{
  "chapter_index": 4,
  "logic_score": 84,
  "character_score": 90,
  "pace_score": 92,
  "information_score": 89,
  "emotion_score": 88,
  "style_score": 91,
  "hook_score": 87,
  "total_score": 89,
  "major_conflict": false,
  "needs_rewrite": true,
  "needs_manual_review": false,
  "problems": [
    "核心主线功能基本达成，但存在若干程序与现实细节偏顺滑的问题，削弱了现场取证的阻力感。",
    "韩啸的阻拦有控场感，但强度仍偏弱。作为老练高管，他在陆川下现场前后的反制动作不够，例如未体现他同步通知现场、试图提前清理口径、限制打印权限等，导致主角拿证据拿得略容易。",
    "苏蔓从观察者转为证据协助者的转折基本成立，但动作升级稍快。她在停车场、现场、调度室连续提供程序支撑和取证指令，容易让读者感觉她已提前站队，应补一两笔她仍保持职业审慎、只站程序和证据的心理或台词。",
    "陆川现场判断很准，爽点成立，但个别表达略接近‘一眼看穿系统根因’，需要再压一压全知感，强化他是通过路线常识、站点反馈、单据比对逐步锁定，而非瞬间定性。",
    "调度逻辑揭示清楚，但‘均衡数据’与‘响应率好看’的业务解释仍可更具体一点。当前读者能明白问题方向，但还差一个更硬的因果链：为什么近单拆远会让某几个报表指标暂时变好。",
    "现场混乱写得够具象，但‘第一次止血意识’着墨不够。章节目标里有‘这事能救，但得先止血’的情绪落点，正文更多停在发现真相，少了陆川脑内初步止血优先级的明确落点。",
    "结尾钩子有效，但与章设要求的‘看到离谱轨迹记录’相比，现在更偏情绪化追问‘谁非要让这套东西继续跑’，单据离谱程度还可再具体一击，增强悬念的证据硬度。",
    "个别句子为追求爽感略有修辞用力过猛，如‘会写PPT的苍蝇’‘全都长出了牙’，虽不算出戏，但略压过了行业现实感。",
    "陆川自行开旧面包车、现场迅速拿到核心轨迹打印，这两处现实阻力略低。若不补强权限、现场混乱和时间紧迫的合理性，容易显得剧情在为主角让路。"
  ],
  "rewrite_instruction": "保留本章整体结构、节奏和主要台词，不重写故事走向，只做强化型修订：1）补强韩啸的老练阻拦：在陆川出发后，加一笔韩啸同步给区域或运营发消息、要求‘先稳住现场口径’或以权限为由拖打印，体现他不是站着挨打；2）微调苏蔓立场表达，增加一句她不是帮陆川站队，而是防止事后有人篡改流程与证据，避免过早无条件盟友化；3）把陆川对系统问题的判断拆成两到三步，先发现错分与空跑，再结合骑手覆盖区和面单轨迹，最后才得出‘近单拆远、强行均衡’结论，压低神探感；4）增加一小段更具体的业务解释，例如系统为了拉平各片区接单率、响应率或忙闲度，把本应就近派送的订单打散，导致报表局部好看但实际送达变慢；5）在发现根因后，补一句陆川的‘先止血’思路，例如先冻结某时段跨区乱派、先保核心商圈直派、先别让骑手继续空跑，但本章不要真正解决，只点出优先级；6）强化结尾硬证据，把某一张轨迹单写得更离谱更具象，例如同一商圈三单被分配给三个相距很远的骑手，形成一眼能看懂的荒唐轨迹；7）适度收敛个别比喻，保留轻喜剧讽刺感，但让行业现场质感更扎实；8）补一笔打印权限或现场取证的不顺，例如调度员迟疑、后台导出受限、需要苏蔓要求保留日志，这样证据获取更有重量。"
}