{
  "chapter_index": 11,
  "logic_score": 90,
  "character_score": 92,
  "pace_score": 91,
  "information_score": 93,
  "emotion_score": 89,
  "style_score": 94,
  "hook_score": 95,
  "total_score": 92,
  "major_conflict": false,
  "needs_rewrite": false,
  "needs_manual_review": true,
  "problems": [
    "结尾直接亮出郑维名字，钩子很强，但与章节任务里“只能到指向层面，不能直接坐实全部真相”的边界较近，容易让下一章悬念空间被压缩，需要人工确认是否接受当前揭示强度。",
    "韩啸的阻拦动机基本成立，但他在关键会议中几乎没有提出任何可执行替代方案，老练感有了，专业反制还可再补一层，否则略显单薄。",
    "何小满从防御到结盟的转折总体顺，但主要靠陆川一句担责承诺完成，心理挣扎还可以再多半步，例如增加他对过往被压制经历的更具体顾虑。",
    "苏蔓功能发挥准确，但本章中她偏工具性，缺少一点属于她自己的观察锋利度或态度落点，人物存在感略偏程序翻译器。",
    "技术取证流程总体符合现实，但‘最终签批节点直接跳出姓名’略显戏剧化，建议补一两句关于权限级别、记录字段或审批单格式的细节，增强可信度。",
    "章节现场案例、后台排查、会议施压三段结构清晰，但中段会议戏略长，若后续连章仍高密度会议对峙，需防止节奏手感趋同。"
  ],
  "rewrite_instruction": "本章整体达标，不建议重写，只建议定点微调。给Kimi的修订指令：1）保留现有主线和结尾钩子，不改剧情走向；2）在韩啸会议段补1-2句更专业的反制话术，例如强调回退模型可能引发局部爆单、数据失真或责任不可逆，以增强其现实型阻拦者质感；3）在何小满答应合作前，补一个更具体的自保顾虑细节，如曾因类似预警被压回、背过锅或被要求删备注，让结盟更有分量；4）给苏蔓增加一句带判断力的观察，不只是教流程，而是点破‘谁最怕留痕，谁就最可能有问题’，强化人物锋芒；5）在终端室取证处补一小段审批记录展示细节，如变更单编号、风险备注字段、签批层级，避免‘一点击就真相大白’的轻飘感；6）人工确认结尾揭示强度：如果希望更悬，可改成“签批链条最终收束到郑维分管线”而非直接亮名；如果接受当前爽点，则保留名字但在下一章立刻强调‘签字不等于全部坐实’，避免过早定案。"
}