{
  "chapter_index": 13,
  "logic_score": 91,
  "character_score": 94,
  "pace_score": 90,
  "information_score": 92,
  "emotion_score": 90,
  "style_score": 94,
  "hook_score": 95,
  "total_score": 92,
  "major_conflict": false,
  "needs_rewrite": false,
  "needs_manual_review": false,
  "problems": [
    "整体完成度高，基本精准命中章节任务，但“按周结”与“历史欠项列清单给时间表”的执行基础略显轻飘，财务承压与总部阻力没有被稍微补一笔，导致承诺成本感略弱。",
    "闪奔到家的挖角专业性写出来了，但其对站长‘整建制过去’的条件只有概述，没有出现一个更具体、更有诱惑力的细节，反派手法还可以再锋利半寸。",
    "何小满在本章功能到位，但技术侧对‘单量密度稳定性’和‘跨区拉单不可持续’的解释略偏工具性，可再给一个更现场化的例证，让信息更扎实。",
    "陆川在院内讲话后，核心骑手转向观望的过程合理，但略顺，缺一两个更尖锐的质疑点来增加拉扯感，否则局部稳住来得稍快。",
    "赵姐电话钩子很强，但与前文‘他们连谁跑早班夜班、谁最近被罚过都摸得清楚’之间的升级关系，可以再补一句区分：前者可能是站点侧打听，后者明显涉及商户复盘内页，从而让危险升级更明确。"
  ],
  "rewrite_instruction": "保持现有结构与主要情节不变，做小幅强化修订，不要重写。第一，补强陆川方案的代价感：在会议段或站点宣讲前，增加一句关于财务卡口、总部阻力或苏蔓明确限定承诺边界的内容，让“按周结、罚款复核、时间表”显得更难、更真实。第二，补强闪奔到家的现实攻击力：给站长挖角条件增加一个具体筹码，例如过渡期保底、带队奖励、片区承包优先权之类，但不要夸张到失真。第三，补强技术与现场结合：让何小满或陆川用一个具体片区例子说明为什么对方保底单量可能靠跨区拉单硬撑、后续不可持续。第四，增加一轮更尖锐的基层质疑，例如针对‘两周后做不到怎么办’或‘历史欠账会不会继续拖’，让陆川和老周的稳人更显得是硬顶出来的，不是轻松说服。第五，优化章末升级逻辑：明确区分“骑手信息被摸清”与“商户复盘数据外泄”不是同一级别，点透后者已经超出普通市场挖角范畴，进一步抬高下一章调查线的紧迫性。"
}