{
  "chapter_index": 19,
  "logic_score": 89,
  "character_score": 93,
  "pace_score": 90,
  "information_score": 91,
  "emotion_score": 88,
  "style_score": 92,
  "hook_score": 87,
  "total_score": 90,
  "major_conflict": false,
  "needs_rewrite": true,
  "needs_manual_review": false,
  "problems": [
    "证据链展示整体成立，但个别关键环节仍偏结论先行。比如“小额往来”如何与郑维本人直接绑定、与外部竞争方直接绑定，文本中只给出陆川判断，缺少一两句更硬的来源说明，容易让“当场定死”显得略快。",
    "董事会层面的程序强度已经拉满，但法务和保安当场控制郑维的动作略显顺滑。若是专项听证，当场冻结权限合理；但直接交出手机电脑，最好补一句依据其岗位协议、公司设备归属或法务紧急保全决定，否则会稍显便利化。",
    "韩啸从控场到失势的转折合理，但其反击火力偏弱。作为擅长汇报和甩责的常务副总，他在被钉上“好看数据优先”责任位后，应该再有一轮更专业的切割或反质询，当前略显收得太快，削弱了对手专业度。",
    "何小满的技术支撑有效，但出场功能性略重。她的证词主要承担“系统不是天然烂，是被带偏”的说明，建议再补一处具体技术细节或她此前被压制的代价，以增强技术线的人味和可信度。",
    "章节核心是“把单号一笔一笔摊开”，但真正展开的代表性单号仍偏少，后半段更快切入结论。可以再补一到两个不同类型的单号样本，分别对应派单失真、赔付异常、商户踩点外泄，让标题兑现得更充分。",
    "魏岚的态度变化写得克制，符合人设，但“临时授权二十四小时”略像剧情按钮。建议补一句她为何只给二十四小时，比如资本方窗口期、舆情观察期或董事会次日复议节点，让时限更具现实压力。",
    "结尾钩子有效，但陆川的内心层面仍偏执行态，没有再轻轻触及一次“他其实已经开始像掌舵者而不只是骑手”的边缘变化，导致与第20章的主动留下衔接还可以更顺。"
  ],
  "rewrite_instruction": "保留本章整体结构、气氛和主要对白，不要重写成别的戏路；按“小修增强证据硬度和对手阻力”的方向自动修订。第一，补强证据链中最容易被质疑的两处：一是“小额往来”与郑维、外部竞争方的直接绑定依据，二是法务当场冻结并保全设备的程序依据，各用一两句落地说明即可，不要长篇法务科普。第二，增强韩啸的专业反击，让他至少再提出一次像样的程序性质疑或责任切割，再由苏蔓和陆川联手打回去，避免反派显得太快失声。第三，补一到两个代表性业务样本单号，分别对应派单异常和赔付/名单外泄后的外部踩点，让“单号一笔一笔摊开”的爽点更扎实。第四，给何小满补一处更具体的技术说明或个人受压细节，强化她不是工具人。第五，给魏岚“二十四小时窗口”增加现实依据，例如董事会次日复议、资本方观察口或核心商户续约节点。第六，结尾保留“锅是洗掉了，可公司，还没送到”，但在此前加半步人物推进：让陆川在计算出勤和商户时，隐约显出他已经不再只是想脱身，而是在本能地接过整盘活。不要提前写成第20章的正式表态，只做轻度铺垫。"
}