{
  "chapter_index": 14,
  "logic_score": 90,
  "character_score": 93,
  "pace_score": 89,
  "information_score": 91,
  "emotion_score": 90,
  "style_score": 94,
  "hook_score": 92,
  "total_score": 91,
  "major_conflict": false,
  "needs_rewrite": false,
  "needs_manual_review": true,
  "problems": [
    "无重大设定冲突，整体与圣经、章节计划、章节任务高度一致。",
    "核心信息基本都完成了，但郑维负责区域与三类异常“高度重合”的证据呈现仍偏口头结论，缺少一两个更硬的可视化或数据化落点，导致怀疑成立、说服力尚可，但离“下一章能拿去顶董事会”还差半步。",
    "董事会临时会议的触发逻辑已经埋出是反制，但具体是谁推动、经由谁发起、韩啸或资本方是否已提前串联，当前只到氛围层，政治攻击链条还可以再清晰一点。",
    "何小满提供的技术侧信息专业感够用，但‘接口调用留存、落地端缺失、七天覆盖、缓存更快洗掉’几处说法略密集，若后续不接住，容易形成似懂非懂的技术烟雾。",
    "苏蔓转为行动盟友的推进是成立的，但还可以补一个更明确的主动承担动作，例如她主动调用秘书处关系、主动定义汇报口径、主动拦住陆川冲动，以强化‘彻底站队’的状态变化。",
    "章节中段查日志、翻权限、补签、邮件绕行的信息密度高，气氛压得住，但场景动势略单一，读者会持续在会议室/机房/档案室内接收信息，现场感偏‘查案’，配送行业的一线烟火气在本章相对变淡。",
    "轻喜剧反差保留得不错，但后半章整体偏冷硬；若下一章继续纯攻防会议，需防连续两章都陷入制度材料战，削弱本书一贯的接地气爽感。",
    "陆川的成长转折‘接受证据链与制度打法’写得清楚，但略显顺滑，缺少一个更具体的小受挫动作来证明他不是嘴上领悟，而是真被现实教育后改变策略。"
  ],
  "rewrite_instruction": "本章可不整体重写，以小修强化证据力度与政治因果。给Kimi的明确修订指令：1）保留现有结构和结尾钩子，不改主线；2）在中段补一处更直观的数据呈现，例如郑维片区近三周商户流失率、异常赔付率、站点波动次数显著高于其他片区的简明对比，让‘高度重合’不只靠人物口述；3）给苏蔓增加一个明确主动动作，体现她已从观察者变成实战盟友，例如主动定汇报模板、卡住取证口径、用秘书处关系抢先固化材料；4）在董事会通知前补一个更清晰的反制征兆，比如韩啸的人提前问责、某份材料被抽走、资本方秘书提前摸底，明确‘有人把查内鬼转成打陆川风险牌’；5）微调一两句技术表述，减少过密术语，保证读者能理解‘日志有缺口但不是空口造疑’；6）若篇幅允许，补一个来自站点或商户端的短反馈，提醒读者陆川查名单外泄的根本动机仍是商户信任、站点生死和骑手收益，而非纯权斗；7）不要提前坐实郑维，不要新增直接铁证，只强化侧证链和被反咬的危险感。"
}