{
  "chapter_index": 9,
  "logic_score": 88,
  "character_score": 93,
  "pace_score": 91,
  "information_score": 90,
  "emotion_score": 89,
  "style_score": 94,
  "hook_score": 92,
  "total_score": 91,
  "major_conflict": false,
  "needs_rewrite": true,
  "needs_manual_review": false,
  "problems": [
    "核心方案基本符合任务要求，但“没有新增预算兜底”的前提与“站长授权补贴”之间的边界解释还不够硬，需要更明确说明这是站内已有可支配小额止血额度，而非新增拨款，否则容易被读者理解为变相开资金外挂。",
    "临时异常单豁免的执行链条略显顺滑。文本写到“总部翻账，我去对”与苏蔓即时发来留痕后，基层迅速信服，阻力真实度稍弱。建议补一两笔骑手半信半疑、站长仍担心追责的细节，让信任建立更扎实。",
    "午高峰数据回升写得有效，但缺少更具体的量化反馈，例如待派从多少降到多少、重点商户投诉压到什么水平。当前“回来了两个点”有用，但整体业务止血的战果还可再具象一点，爽感会更强。",
    "竞争对手挖骑手的压力有提到，但主要停留在台词层面，现场对运力的直接撬动表现不够。可补一个已被拉走或摇摆中的骑手案例，使外部压力更真实，也能更突出陆川不是靠嘴而是靠规则止血把人留下。",
    "赵姐一场戏完成度高，但她从强压到暂缓切换的转折略快。虽然有履约改善支撑，仍可增加一个她亲眼确认签收回传或门店催单电话明显下降的动作，进一步坐实态度变化。",
    "尾部热搜短视频钩子有效，但“镜头扫到白板一角+压低口令”已经很强烈指向内部泄露，悬念略偏直给。若后续还要保留调查空间，建议本章末稍微收一收判断，把“明显懂内部”改成“高度可疑”，避免过早定性。"
  ],
  "rewrite_instruction": "对第9章做中度精修，不改主结构与主要情节节点，重点补强业务逻辑与止血可信度。1）明确补贴来源：补一句这是站点原有可控止血额度或临时腾挪的有限池子，不是总部新增拨款；强调额度极小、先登记后复核、超额无效。2）加强阻力：在异常豁免落地时，补一两个骑手和站长继续质疑“回头系统秋后算账怎么办”的细节，再由苏蔓留痕、何小满截图、陆川担责三重动作压住，提升说服力。3）补强量化成果：在午高峰后增加两三组更具体的数据变化，如待派单、超时预警、重点商户投诉的下降幅度，但不要写成奇迹逆转，要保持“难看但管用”。4）把竞争对手挖人写实一点：补一个骑手已准备转走、因豁免与补贴规则改动而决定先跑完这班的细节，体现外部压力真实存在。5）赵姐的态度变化增加一个可视化证据，例如她看到后台签收回传、门店催单电话明显减少，才说“先不切”。6）收束结尾判断，保留“内部有人配合放料”的高度可疑感，但先不要让陆川内心完全定案，避免悬念提前透支。"
}