{
  "chapter_index": 7,
  "logic_score": 88,
  "character_score": 93,
  "pace_score": 92,
  "information_score": 89,
  "emotion_score": 91,
  "style_score": 94,
  "hook_score": 90,
  "total_score": 91,
  "major_conflict": false,
  "needs_rewrite": true,
  "needs_manual_review": false,
  "problems": [
    "核心完成度高，基本命中章节任务，但“站点止血”的执行链条还差一层可验证的业务闭环，导致解决过程略显顺滑。",
    "陆川临时承诺“超时争议先记站点调整，不往个人头上挂，我来记”，人物气质是对的，但制度可执行性不足。若不补一句他依赖老周、调度截图、苏蔓或后台留痕去留证，容易显得口头兜底过轻。",
    "调度侧阻力偏弱。当前只有小调度员被动配合，缺少一点“系统自动派发关不干净、手动拦单成本极高”的具体摩擦，会削弱问题的硬度。",
    "电子屏数字从113一路涨到191再回落到129，现场感够强，但缺少一个简短时间锚点，读者不易判断陆川压住这一波究竟用了多久，止血成果的含金量可再明确。",
    "老周态度转折总体成立，但从冷嘲到直接吼场配合的转折略快，建议加一个更具体的触发点，例如陆川跑回后准确指出某位骑手被跨区坑单、替老周说出站点痛点，从而让老周决定押一把。",
    "总部黑话与现场人话反差写得好，但本章与上一阶段“高层汇报与现实不一致”的延续性还可再补一刀，例如让陆川顺口点名某个汇报口径，形成更明确的打脸承接。",
    "赵姐结尾出场有效，但她手里的超时和客诉记录若能与本章前面某个被优先救火的商户群产生呼应，钩子会更扎、更有连续因果。",
    "章节没有重大设定冲突，也未把主角写成霸总或全能，但陆川现场拆区、并单、压红单几乎都判断正确，建议补一个小失误或代价，让“能赢但不轻飘”的原则更稳。"
  ],
  "rewrite_instruction": "保留现有结构与主要桥段，不重写路线，只做增强型修订：1）在陆川提出“超时争议先记站点调整”处，补充具体留痕手段与后续扛责依据，比如让调度员截图、老周作证、后台导出异常派单记录，避免口头兜底失真；2）加强系统与人工调度的摩擦，补出一两个“手动拦单来不及、系统还在持续吐跨区单”的细节，让问题更硬；3）给止血过程补一个明确时间锚点和结果数据，例如四十分钟或一小时内压下多少红单、哪些片区恢复可控，提高商业解决的可信度；4）在老周改口前增加一个更扎实的触发动作，不要只靠陆川热血下场，最好是他准确识别某个站点老问题并当场帮老周减压；5）给陆川补一个小代价、小失误或身体狼狈后的判断修正，避免显得过于顺；6）把赵姐结尾与前文某批红单、某商户连锁爆炸风险做因果勾连，让下一章商户线不是新危机插入，而是本章后果自然升级；7）可以顺手补一句对总部汇报口径的反讽承接，强化第6章到第7章的连续打脸感。"
}