{
  "chapter_index": 20,
  "logic_score": 89,
  "character_score": 93,
  "pace_score": 91,
  "information_score": 90,
  "emotion_score": 92,
  "style_score": 94,
  "hook_score": 90,
  "total_score": 91,
  "major_conflict": false,
  "needs_rewrite": true,
  "needs_manual_review": false,
  "problems": [
    "整体完成度高，基本命中本章任务：商户观察期、站点公开站队、董事会默认继续掌舵、主角主动留下、第二层文件钩子都已落地。",
    "无重大设定冲突。陆川仍是接地气的一线脑子，不像霸总；苏蔓承担制度翻译，没有越权替主角做决定；韩啸也只是技术性收缩，没有突兀下线。",
    "逻辑上有一处轻微悬浮：从临时指挥室到赵姐店内再到站点棚再到董事会，当天内连续完成商户签观察期、站点验证后台权限、董事会态度转向，节奏爽但略密，容易显得所有关键方都在同一时段恰好被说服。建议补一两笔时间标记或执行反馈，增强真实感。",
    "赵姐现场看到几单迅速恢复正常，就签三天观察期，虽然前文有协议与数据支撑，但转折仍稍快。建议再加一句她此前已收到部分异常回补/门店已连续多少分钟无乱派单，以增加她松口的现实依据。",
    "站点侧的支持成立，但目前更偏口头表态。既然本章要坐实基层信任，建议补一笔更硬的动作证据，例如几个站长当场撤回撤人决定、恢复晚高峰排班、或骑手群内对新赔付规则的即时反馈截图。",
    "董事会默认陆川继续掌舵的过程基本成立，但资本止损派与其他董事让渡空间略显顺滑。建议补一笔他们附带的约束条件，如三天数据阈值、每日复盘、专项留痕要求，让“承认”更像利益驱动而非气氛带动。",
    "程振山旧备忘揭示‘为什么是陆川’很有效，但信息投放略直给，几乎当场完成悬念回收。建议保留一句模糊空间，比如那次事故后程振山还做过额外观察，避免伏笔一次性收得太死。",
    "卷尾文件袋钩子有效，但‘名单’的性质已经说得比较明。若想增强下一卷悬念，可略收一点，只点出涉及原始路线分歧与早期人事，不必把两派主张讲得这么完整。",
    "文风稳定，‘人话对黑话’反差持续成立，且商业问题都落在履约、赔付、调度、客服等具体层面，符合题材承诺。",
    "情绪线完成得较好，尤其‘这公司，我先不让它倒’落点准确，既不是霸总宣言，也完成了阶段升格。"
  ],
  "rewrite_instruction": "对第20章做中度精修，不推翻结构，不重写主干，只增强真实履约感与利益博弈硬度。给Kimi的明确修订指令：1）在赵姐签观察期前，补1-2个更可验证的即时改善细节，例如乱派单已连续压住多久、首批老赔付已回传、门店异常群已有响应记录，避免她松口过快；2）在站点棚段落补一条更硬结果，不只口头站队，要出现具体执行动作，如某站长取消撤人、恢复排班、或骑手群看到免责规则后的实际反应；3）在董事会段落给魏岚或其他董事增加更明确的附带条件，例如三天履约阈值、每日复盘、专项留痕、观察期不过即重启止损方案，让他们的承认更具现实算计；4）在全章中补轻量时间锚点或数据回传，缓解‘同一天连续说服所有关键方’的顺滑感；5）保留程振山旧备忘，但把解释收半步，不要把‘为什么选陆川’一次讲透，可留一句他后来还持续观察过；6）卷尾第二层文件再收一点信息，不要把两条路线定义得过满，保持‘门缝式揭示’。核心要求：保留现有情绪落点、台词风格和卷终收束，不要把陆川写成突然成熟的职业董事长。"
}