{
  "chapter_index": 3,
  "logic_score": 88,
  "character_score": 92,
  "pace_score": 90,
  "information_score": 86,
  "emotion_score": 91,
  "style_score": 93,
  "hook_score": 94,
  "total_score": 90,
  "major_conflict": false,
  "needs_rewrite": true,
  "needs_manual_review": false,
  "problems": [
    "整体完成度高，核心反差、会议黑话与一线人话对撞都成立，但仍有轻微执行层逻辑跳步。",
    "陆川在会议中直接点出“南城仓”“西河站”两个具体异常点，前文没有交代他是通过何种渠道、何时看到这些信息，容易让读者产生信息来源悬空感。",
    "“会议快一个小时”这一句与正文呈现的会议进程体感略不匹配，文本展示更像中段即被打断，时间标记稍显硬贴。",
    "苏蔓从程序性中立到出言援引章程支持现场核查，转变合理但略快，建议补一个更明确的心理判断或程序依据，让她不是像临时站队，而是基于规则推进。",
    "韩啸与其他高管的区分度已有，但除韩啸外，运营、客服、财务三方话术略同质，容易形成‘一屋子一个声腔’的问题，削弱真实职场层次。",
    "数据异常已被指出，但异常的具体程度仍偏虚，缺少一两个更抓手的数值或对比，会让‘报表失真’的说服力稍弱。",
    "结尾“谁不敢去，谁心里有鬼”情绪很足，但略微提前拔高到审判口吻，当前章节证据层级仍只到‘失真/过滤’，离‘有鬼’还差半步，存在轻微用力过猛。"
  ],
  "rewrite_instruction": "保留现有结构、对白节奏和结尾转场，不要重写成本章外的现场戏。重点做四项修订：1）补足陆川掌握异常站点信息的来源，在会议开始前或中段加一句他提前扫过实时看板、群消息、白板数据或苏蔓递来的简报，确保他点名南城仓、西河站有依据；2）微调时间感，删改“汇报快一个小时”这类与体感不完全匹配的表述，或在前文增加会议已持续一段时间的明确过渡；3）强化苏蔓的程序性支持逻辑，在她援引章程前增加一个判断锚点，比如她意识到韩啸持续回避具体点位、而陆川提出的是董事长合法核查权，不是情绪胡闹；4）把“谁心里有鬼”稍微收一收，改成更符合当前证据层级但仍有压迫感的话，例如强调“谁不敢去，谁就别跟我说可控”。另外，建议顺手给运营、客服、财务各补一处更符合本部门的具体话术差异，并加入一到两个简短但明确的数据对比，增强报表与现场割裂的真实度。"
}