{
  "chapter_index": 1,
  "logic_score": 82,
  "character_score": 90,
  "pace_score": 91,
  "information_score": 88,
  "emotion_score": 89,
  "style_score": 92,
  "hook_score": 93,
  "total_score": 89,
  "major_conflict": false,
  "needs_rewrite": true,
  "needs_manual_review": true,
  "problems": [
    "核心设定未出现重大冲突，整体符合小说圣经与本章任务，但“授权的现实有效性”仍偏悬浮，缺少更硬的程序抓手，容易让读者质疑创始人一句话就能把骑手塞进董事会。",
    "陆川接到“迅城达总部顶层秘书处、必须本人送达、不得转交前台”的文件单过于巧合，像作者手推剧情，需要补一层合理来源，否则卷入方式人工痕迹重。",
    "程振山点名陆川的前因完全空白，悬念是需要的，但当前几乎没有任何微弱提示，容易让读者把它理解成纯神来一笔而非有预埋的选择。",
    "苏蔓在法务与董秘身份下，推动宣读文件的动作是成立的，但她为何在局势高度敏感时坚持当场宣读，动机仍略单薄，缺少她基于程序风险、证据保全或防篡改的明确判断。",
    "韩啸与魏岚的反应方向基本正确，但董事会其他成员的反应偏功能化，多为惊呼和质疑，尚未体现“高管不降智”的差异化逻辑。",
    "行业危机氛围立住了，但公司真正濒临崩盘的业务症状只点到‘混乱’和‘控场’，缺少一两个更具体的坏信号，例如客诉、站点、履约率、赔付异常，信息颗粒还可以再实一点。",
    "会议室段落节奏强，但从会客区进入董事会的转场略快，陆川被带入正式会议的阻抗不足，少了一点‘他强烈想走却被程序和局势一步步按住’的压迫过程。",
    "陆川的吐槽非常鲜活，但个别句子过于稳定输出金句，略有作者加工感；若后续继续加码，需警惕把主角写得过于会怼、过于轻松，削弱底层焦虑的真实重量。",
    "授权文本写到‘参与公司重大决策事项之召集、确认与临时处置’，分量已经很重，但又被描述为‘含糊但有效’；目前“含糊”与“有效”的边界还不够清楚，建议补一两句说明为何它能生效、但又足以引发解释权争夺。",
    "结尾钩子强，但停在‘为什么选他’这一悬念上略单一；如果补一丝更具即时威胁的后续压力，比如‘下一秒就要他坐主位/表态/签第一份文件’，会更炸。"
  ],
  "rewrite_instruction": "保留现有结构、文风和结尾身份炸弹，不重写剧情走向，只做增强型修订。第一，给“文件单把陆川送进总部”补一层现实因果：明确该件来自创始人办公室/秘书处临时指定加急，或是原定内部传递失灵后改走骑手渠道，避免纯巧合。第二，强化授权合法性的程序细节：增加秘书记录方式、医生见证原因、签字页关键信息、公司章程或应急授权惯例的简短提及，让读者相信它不是儿戏，但同时保留授权范围模糊、可被争夺解释权。第三，给程振山为何认识陆川埋一个极轻的前置痕迹，不要解释透，只需一句让陆川或苏蔓意识到“这不是第一次被注意到”，例如工号、某次现场事件、名字被提前记住。第四，补足苏蔓坚持当场宣读的职业动机，明确她不是突然站队，而是担心文件被截留、篡改、失效或被某方私下处理，所以必须入正式记录。第五，丰富董事会成员反应的差异化：有人先质疑章程，有人先算舆情风险，有人先担心投资方问责，有人当场判断这是挡火墙安排，避免群体只会震惊。第六，在前半段或会议段补两处更具体的公司危机信号，比如履约率跳水、站点闹情绪、客诉爆量、媒体待发稿件，用业务现实支撑总部紧张感。第七，略微增加陆川被强留的压迫过程，让他从‘想送完单离开’到‘被程序和权力现场封死退路’更有层层递进。第八，控制金句密度，保留人话反差，但适当加入他对超时、赔付、还债的真焦虑，压住纯喜剧漂浮感。第九，结尾在现有悬念上再加半步现实逼迫，可用众人目光压向主位、要求他坐下或立刻确认某项处置，增强下一章承接力。"
}