{
  "chapter_index": 15,
  "logic_score": 84,
  "character_score": 90,
  "pace_score": 91,
  "information_score": 88,
  "emotion_score": 92,
  "style_score": 93,
  "hook_score": 90,
  "total_score": 89,
  "major_conflict": false,
  "needs_rewrite": true,
  "needs_manual_review": true,
  "problems": [
    "总体完成度高，基本命中本章任务：董事会问责、韩啸发难、魏岚给窗口、苏蔓点醒、郑维区域新事故与结尾钩子都已到位。",
    "逻辑层面存在一处偏硬的巧合：董事会刚形成七天观察决定后二十分钟内，郑维区域就爆出大面积错派、骑手事故、热搜文案同步成型，虽然有利于制造压迫感，但目前缺少一个更具体的前置触发说明，容易让读者觉得作者手推事故而非因果自然发生。",
    "郑维电话里的镇定和话术很像内鬼预警，但当前暴露感略重。按阶段要求，本章应埋怀疑而非让读者几乎锁定他，建议弱化其“稳得过头”的表现，增加一层可供误判的管理失误外衣。",
    "魏岚的价值判断写得准，但她为何在高风险节点仍愿意给七天窗口，动机还可以再加半句现实支撑，例如核心区域回升对资产估值、谈判筹码或拆卖价格的影响，否则她的‘不立即换人’略显功能性。",
    "董事会问责的制度压力已经有了，但书面决定的约束细节略虚。比如由谁监督、每日复盘还是七天后复核、替换程序启动条件是否需要补充一句，会让程序围剿更真实、更有压迫感。",
    "陆川反击主要依靠嘴上顶住和口头成果陈述，虽然符合他不懂高层话术的人设，但可再补一个更具体的数据或现场案例锚点，让‘局部反顶’更扎实，避免像情绪上顶住而不是业务上顶住。",
    "苏蔓功能发挥有效，但略偏工具性。她连续承担‘翻译人话’和‘点醒内鬼线’两项关键功能，建议给她一处来自法务/董秘视角的独有观察依据，增强人物专业性，而不只是替作者下判断。",
    "结尾事故段落张力很强，但‘社媒热榜词条刚冒头’、‘营销号文案像一个模子刻出来的’这类判断，如果没有补一个传播速度异常或内部截图外泄的细节，会显得主角团队过快得出“有人操盘”的结论。",
    "文风延续优秀，轻喜剧里的职场冷感和一线烟火气结合得好，没有把底层困境写轻，但个别金句略密，连续比喻稍多，可能轻微冲淡问责戏本该有的冰冷真实感。"
  ],
  "rewrite_instruction": "保留本章结构和主要事件，不重写剧情走向，做一次针对逻辑链与证据感的强化修订。重点修改：1）在董事会会前或会中补一两个更硬的数据锚点，具体到某区域送达率、赔付回落、商户续签或骑手流失变化，让陆川的反击不只靠态度；2）给魏岚补足现实动机，用一句话明确她给七天窗口是因为核心履约回升会直接影响资产估值、商户续约谈判或拆卖价格，她不是心软，是继续做价值测试；3）把董事会‘最后观察期’写得更程序化，补充由谁监督、以什么频率复盘、何种条件触发替换，使卸椅子的威胁更真实；4）弱化郑维过早暴露，把他电话里的异常镇定收一点，增加可解释为普通高管甩锅或管理失误的表层理由，不要让本章就几乎坐实他有问题；5）强化事故与舆情同步爆发的前置因果，补一处细节说明例如调度后台某时间点异常跳权重、投诉截图集中外流、营销号抢先发稿所依据的内部截图来源迹象，这样‘有人放火’的判断才更成立；6）给苏蔓增加一条更专业的观察依据，例如她从会议流程、材料补发时间、舆情口径一致性或法务风险视角判断这是程序性围剿，而不是单纯作为解释器；7）压缩一两处过于显眼的金句式比喻，保持冷硬问责感。修订目标：不改变本章高压效果和结尾钩子，但让危机升级更像必然结果而非作者推手。"
}