{
  "chapter_index": 10,
  "logic_score": 86,
  "character_score": 91,
  "pace_score": 93,
  "information_score": 89,
  "emotion_score": 90,
  "style_score": 94,
  "hook_score": 92,
  "total_score": 90,
  "major_conflict": false,
  "needs_rewrite": true,
  "needs_manual_review": false,
  "problems": [
    "整体完成度高，章节功能基本达成，但存在若干可修补的逻辑压缩问题。",
    "舆情发酵到商户群、站长群、董事会同步施压的链路写得顺，但传播速度略显过快，缺少一两个更具体的中间节点支撑，例如哪个本地号搬运、哪个商户群先炸、哪位站长最先恐慌，导致“精准传播”虽成立但略有作者上帝视角感。",
    "陆川在会议室到站点、再到赵姐门店、再回会议室、最后到调度办公室，行动线很满，但时间刻度偏模糊。尤其从上午舆情爆发到中午局部数据显著回升，再到董事会态度微变，节奏爽利但略显理想化，建议补两三个时间锚点增强可信度。",
    "赵姐从强烈质疑到回单四成的转变成立，但目前主要靠一句‘至少这波，不像是只会演’，略快。可以补一个她实际看到的具体结果反馈，例如某批重点单压住差评、某门店后厨不再堆单，以增强商户回流的商业真实感。",
    "韩啸的方案逻辑基本成立，但阻力层次还可以更细。他现在主要承担路线对立与甩锅功能，尚可再补一句他为何坚持收口，例如担心加盟站点各说各话引发监管或赔付连锁，以避免角色显得过于标准反派。",
    "苏蔓在本章作用有效，但从‘看出镜头不对’到‘按内控事件查’推进很快，专业上可以再加一个更具体的法务/内控抓手，例如监控访问权限、素材拍摄授权归档、群发节点留痕，能让她的判断更像制度型人物而非作者代言人。",
    "何小满拿出日志的悬念很强，但‘不是黑客电影那种，就是内部权限被人动过手脚’这句虽然通俗，仍稍泛。建议补一条更具体的异常样态，例如调用了哪个废弃权限组、哪个审批记录缺失，以便下一章更顺畅切入系统线。",
    "本章数据反压舆情的爽点成立，但‘准时率从六十一拉到八十三’提升幅度较大，若时间窗口仅一个午高峰，容易让部分读者觉得过顺。建议稍微降低提升幅度，或补充‘只统计重点门店和重点线路’来限定样本范围。",
    "少数董事改观的桥段有用，但个体辨识度偏弱，除了魏岚外，其他董事仍较模糊。若后续要承接董事会分裂，本章最好让一位具体董事形成初次站队印象。",
    "结尾气氛到位，但陆川最后一句‘那接下来，就不是光送单了’略有常规收口感，可以保留意思但让前文异常记录与他个人判断的连接更锋利一些。"
  ],
  "rewrite_instruction": "给Kimi的修订指令：1）不改章节主结构，不重写大段，只做局部补强；2）在前半段舆情扩散处补1到2个具体传播节点，明确先进入哪个商户群/本地从业群、由哪类账号搬运，强化‘精准投放’而非抽象爆火；3）在上午到午高峰的推进中补明确时间锚点，如10:20、11:40、12:30，增强业务恢复的现实感；4）把赵姐回单的依据写得更具体，增加一个她亲眼确认的履约改善细节，不要只靠态度台词转变；5）给韩啸补一句更像职业高管的理由，说明他为何坚持统一口径，不要让他只像反派；6）强化苏蔓的专业动作，明确她要调哪些权限记录、授权归档或群扩散留痕；7）何小满的日志说明再具体半步，用一个普通读者能懂的异常例子说明‘越权’到底异常在哪；8）适度收敛数据逆转幅度，或限定统计口径为重点门店/重点线路，避免显得恢复过快；9）在董事会里点亮至少一位除魏岚外的具体董事态度变化，为后续分裂做铺垫；10）保持现有接地气文风和快节奏，不要拔高成公关大战，不要削弱‘靠履约结果反压舆情’这一核心路线。"
}