{
  "chapter_index": 2,
  "logic_score": 90,
  "character_score": 93,
  "pace_score": 91,
  "information_score": 92,
  "emotion_score": 89,
  "style_score": 94,
  "hook_score": 93,
  "total_score": 91,
  "major_conflict": false,
  "needs_rewrite": true,
  "needs_manual_review": false,
  "problems": [
    "整体完成度高，核心任务基本达成，但存在少量信息重复：苏蔓对授权有效且边界模糊的说明，在走廊和会议室内各讲一遍，功能相同，削弱了推进效率。",
    "韩啸的操盘能力写出来了，但当前表现略偏单线‘稳口径+推责任’，还可以再补一两个更具体的程序性动作，让他的老练更有压迫感，而不只是会说场面话。",
    "魏岚形象基本成立，但出场信息偏少，当前更像功能性提问机器。她的‘观望而非打压’已具备，仍可再加一处更有投资人视角的判断，以增强辨识度。",
    "陆川在会议中连续精准追问超时率、投诉数、欠款、流失率，人物上是成立的，但如果没有一点‘听不惯报表、只抓最要命数字’的过渡，容易略显过于顺手，建议补一两句心理或观察支撑，避免像突然适应会议节奏。",
    "结尾危机简报有压迫感，但信息基本集中在‘超时、投诉、欠款、停运威胁’，和章节计划要求高度一致，却仍稍偏清单式堆叠。可增加一个更具场景感的异常细节，让下一章现场落地更自然。",
    "个别金句和吐槽非常亮眼，但略有密集化倾向，后半段若再收一收俏皮话，能让危机感压得更实，避免轻喜剧语言稀释商业崩盘的重量。",
    "本章几乎全部发生在会议室与门外，符合本章目标，但现场业务危机的具象画面主要依赖陆川脑补而非外部反馈。建议在简报或电话中嵌入一句来自站点或商户的一线原声，提高真实度。"
  ],
  "rewrite_instruction": "保留本章整体结构、反差喜感和结尾钩子，不要重写大框架，做局部增效修订。第一，压缩重复说明：将苏蔓关于‘授权有效但边界模糊’的两段解释合并或错开功能，走廊里讲程序成立，会议室里只补权限边界与责任归属，避免重复。第二，强化韩啸的专业甩锅感：补一个具体动作，例如他主动推动纪要、建议统一对外口径、要求经营层‘全力配合’却不落任何实责，让读者更清楚他是在制度上铺垫责任转移。第三，微调陆川的会议表现逻辑：在他连追关键数据前，补一句他对‘箭头、环比、同比’不耐烦，但本能知道先抓超时率、投诉、欠款这三个最会炸的一线指标，稳住人物可信度。第四，给魏岚补一处更鲜明的投资人判断，比如她不是关心谁难堪，而是在快速判断这家公司还有没有保全价值，从而突出她的冷静止损视角。第五，优化结尾简报的呈现方式，不只列数据，加入一句更具现场温度的一线原声，例如站长群截图、商户语音转述或骑手压单后的直接反应，为下一章去现场做更顺的桥接。第六，后半章适度减少连续俏皮吐槽，保留最有力的两三句，把更多笔墨让给危机压迫感。总原则：不改剧情结果，不改人物关系，只提升信息层次、职业压迫感和现实质感。"
}