{
  "chapter_index": 5,
  "logic_score": 88,
  "character_score": 92,
  "pace_score": 90,
  "information_score": 91,
  "emotion_score": 89,
  "style_score": 93,
  "hook_score": 94,
  "total_score": 91,
  "major_conflict": false,
  "needs_rewrite": false,
  "needs_manual_review": true,
  "problems": [
    "整体完成度高，核心任务基本全部命中，但“局部回切后核心站点仍立刻爆发停单”与“系统都还没跑完”并置，虽然文本已解释二者并非直接因果，仍容易让部分读者误判为章节制造假因果，建议再补一处更明确的时间链提示。",
    "韩啸的专业性和甩锅意识写出来了，但他在走廊里当面说“此次波动发生在调度策略调整窗口期”略显过早外露，容易让角色心机从隐性变成显性，削弱其职场老手的真实感。",
    "何小满的倒向动机基本成立，但“我留过底，可以整理几个关键参数改动给你看”已经接近关键证据投诚，放在首次私聊里略快，建议增加一点保留和试探，避免盟友建立过顺。",
    "陆川在会议中的判断力很强，符合人设，但连续多轮精准拆解模型错位后，略有接近‘天生会开运营复盘会’的观感，需再保留一点他对术语、程序的不适感，突出他是凭现场直觉硬顶，而非无缝切入管理层语言体系。",
    "苏蔓的功能到位，但存在轻微“工具型翻译器”倾向，目前主要承担权限翻译和程序补位，建议后续补一点她自己的判断或风险预判，让人物更立体。",
    "章节标题强调‘一张调度单’，正文里有派单轨迹和具体订单，但‘一张调度单’这一抓手还不够具象，缺少一个能被记住的单据物证或截图式细节，导致标题与正文意象连接度略弱。",
    "结尾升级有效，但老周在电话里一次性把‘跨区乱派、空跑、超时赔付、人心没了’全说透，信息密度略高，稍有代作者总结感，建议压缩一部分为下一章现场呈现。"
  ],
  "rewrite_instruction": "本章无需重写结构，做定点增强即可：1）在‘局部回切’执行后到‘站点停单’爆发之间，补一句更清晰的时间说明，明确停单是前期积怨集中爆发，不是回切即时导致，消除假因果歧义；2）微调韩啸走廊台词，让其甩锅更隐蔽、更职业，不要说得太直白，保留城府；3）收一收何小满首次投诚的证据力度，可改为只承认“版本被上面改过、他能整理方向性变更”，暂不一次性交太多底牌；4）在陆川下指令前后补一点他对会议程序不耐烦、但被苏蔓强行校正表达的细节，强化‘笨拙但硬顶’而非熟练管理者；5）若篇幅允许，给‘一张调度单’增加更具体的物证感，比如某张典型异常派单截图、单号、时间戳或赔付联动记录，让标题更落地；6）压缩老周电话里的总结性信息，把部分判断留到下一章站点现场用冲突和人物反应展开。"
}