{
  "chapter_index": 18,
  "logic_score": 84,
  "character_score": 91,
  "pace_score": 90,
  "information_score": 88,
  "emotion_score": 92,
  "style_score": 93,
  "hook_score": 94,
  "total_score": 90,
  "major_conflict": false,
  "needs_rewrite": true,
  "needs_manual_review": false,
  "problems": [
    "证据链当前仍偏‘可疑链条’而非‘硬证据链’：异常导出、提前生成草稿、超范围权限申请都能支撑董事会质询，但距离直接坐实郑维与外部竞争者勾连仍差一跳，和章节任务中‘留下更直接的交易痕迹’相比还不够硬。",
    "老周站点配合做局的动机成立，但‘为什么此刻愿意压这一晚’的前史回扣略短，更多是口头说明，缺少一个更具体的已兑现旧规细节来加强基层倒向的可信度。",
    "苏蔓‘截获报告’的程序动作写得顺，但‘截获’更像依权限卡节点，不算真正高难度反制；若后文要据此发动董事会攻防，本章最好再补一层合规依据，避免显得过于方便。",
    "何小满的技术作用有效，但技术方案略显功能化，A/B口径投放、权限留痕、异常导出三件事连续命中，戏剧性足，真实性还可再压实一点，例如补一句为何郑维此前有这种订阅权限基础。",
    "夜高峰现场危机起得快、压得住也快，读感爽，但‘拟切核心站点止损’截图来源不明，像是被人故意放风却未当场追一下来源，会让局势推动显得稍微服务剧情。",
    "陆川的规则承诺很对路，但‘明早九点前走补差单’这种执行承诺涉及总部财务/流程协同，本章未交代他凭什么能确保兑现，存在轻微执行落地缺口。"
  ],
  "rewrite_instruction": "保留本章结构、场景顺序和结尾钩子，不重写，只做增强型修订。1）强化证据硬度：在不靠偷听和外挂的前提下，补一处更直接的留痕，例如郑维线上的人对某站、某商户名单、某挖角节奏作出只有外部对接过才会知道的精准指令，或其助理在内部流转备注里出现与外部节奏高度对应的措辞，让‘更直接的交易痕迹’落地。2）补强老周倒向的现实基础：在站点对话里加一个具体已兑现案例，明确陆川此前改过哪条赔付/补贴/线路规则，站点确实因此少赔了多少钱或少炸了一次仓，不要只靠‘改过真规矩’概述。3）补苏蔓的制度抓手：把她卡报告的依据写得更明确，比如董事会紧急材料必须经过法务合规复核、风险定性材料需附现场佐证，避免‘截获’显得方便。4）补何小满技术链合理性：增加一句郑维为何有订阅权限、为何异常导出能被识别，减少工具人感。5）夜高峰截图风波处，补一句对截图来源的判断或暂不追源的原因，显示主角团队不是没想到，而是优先级取舍。6）把陆川‘明早九点前补差单’的兑现路径补一句，说明是临时联签权限已开、苏蔓备案、调度和站长可先挂账后复核，确保他的承诺不是空口。整体要求：维持高压、并肩、接地气的基调，保留轻喜剧火花，但把‘爽’再建立在更扎实的业务与程序逻辑上。"
}