{
  "chapter_index": 17,
  "logic_score": 89,
  "character_score": 93,
  "pace_score": 90,
  "information_score": 91,
  "emotion_score": 88,
  "style_score": 94,
  "hook_score": 92,
  "total_score": 91,
  "major_conflict": false,
  "needs_rewrite": true,
  "needs_manual_review": true,
  "problems": [
    "整体完成度高，基本贴合章节任务，但关键证据链的合规性仍略显概念化：苏蔓提出流程名目与方向是对的，但缺少一个更具体的已执行动作，例如谁发起、何时留痕、何小满基于什么授权开始筛日志。当前读者能理解“合规路径”，但未完全感到“这份证据真能上董事会”。",
    "异常IP指向闪奔合作公关公司的发现推进得稍快，存在轻微便利化风险。前文强调不能像开外挂一样几分钟拿出真相，但正文里何小满通过“公开工商和招投标资料比对”很快锁到目标，虽然不是完全失真，但还可以补一层不确定性或中间步骤，避免显得过顺。",
    "郑维的反制存在感主要靠他人转述和气氛铺垫，虽然符合‘对手老练’定位，但本章中他清理痕迹、压口风的具体表现偏少，导致‘双方抢时间’的对抗感还可再增强。",
    "老周结尾情报钩子有效，但前文对老周作为外围观察者的植入仍偏轻，只有一句‘郑维那边显然也没闲着’和站点备注式信息，若能在中段更明确出现老周前置反馈，结尾会更扎实。",
    "陆川的业务判断力写得很稳，但个别比喻和判断已经接近‘看一眼就锁定模式’，需注意保持他是凭一线经验缩小范围，而不是近似侦探式天赋推理。",
    "本章信息密度高，但调查段落略集中在室内和屏幕前，场景层次稍单一。虽然不构成硬伤，但与本书一贯‘站点/商户/现场感’相比，烟火气略降，建议加一点来自站点或商户的实时反馈切面，强化落地感。",
    "章节标题‘顺着一条日志，摸到一只手’与正文高度匹配，但正文结尾‘回去，不等明天了’很强，仍可再补一个更具体的下一步行动指向，让桥接第18章更利落。"
  ],
  "rewrite_instruction": "保留本章结构、对话风格与核心发现，不要重写剧情走向，只做增强型修订：1）在苏蔓提出合规路径后，补一到两处具体流程动作，明确谁以什么名义发起风险排查、何小满查看哪些节点日志是基于什么授权，强化‘证据可上董事会’的可信度；2）把异常IP关联闪奔合作公关公司的过程写得再多半步，加入一层比对、迟疑或交叉验证，避免显得太快太巧，保留‘高度关联但未钉死’的审慎感；3）增加郑维正在清痕、压口风的一个具体侧写，可以是权限联系人被替换、群内口径收紧、临时审批异常等，让对手的老练更可见；4）在中段提前更明确地嵌入老周的外围反馈，例如他先前提到站点附近有人递烟探口风，这样结尾深夜来电更不突兀；5）适度补一点站点或商户端的即时反馈切片，让调查线始终落回‘保履约、保骑手、保商户’而不是纯后台侦查；6）收束时给陆川一个更明确的下一步布网动作表述，例如先稳哪几个站、盯哪类权限触发，为第18章制造更强的行动接缝。"
}