{
  "chapter_index": 16,
  "logic_score": 84,
  "character_score": 92,
  "pace_score": 90,
  "information_score": 88,
  "emotion_score": 91,
  "style_score": 93,
  "hook_score": 89,
  "total_score": 89,
  "major_conflict": false,
  "needs_rewrite": true,
  "needs_manual_review": true,
  "problems": [
    "核心主线完成度高，陆川在“自保解释”与“先救现场”之间的选择成立，且符合其价值观，但“解释会缺席”的后果目前只被口头强调，缺少一个更具体、更具即时性的制度代价，导致冒险感还可以更实。",
    "苏蔓从程序优先转向冒险支持的转折基本成立，但略快。她前一秒强调问责和缺席风险，后一秒就全程跟去并协助越线，缺少一个更明确的心理触发点或利益判断节点，建议补一个她亲眼看到骑手/商户损失后态度改变的细节。",
    "现场止血写得较扎实，但“口头冻结扣罚”在公司权力链上略悬。陆川作为临时董事长可以强压，但最好补一笔：财务、人资、风控未必立刻执行，因此需要苏蔓同步发临时处置留痕或站点群公告，否则现实感稍弱。",
    "事故归因推进到“郑维辖区异常权限调整”是对的，但当前线索抛出偏顺。何小满较快就从参数、热力图、残留日志一路查到外部连接，缺少一点技术阻力或数据不完整的艰难感，容易显得证据来得太及时。",
    "老周的人设总体稳，但后段存在轻微功能化倾向。前面他现实劝阻有力，后面更多只承担接人、吐槽、见证作用，缺少一个来自老站长视角的现场判断补充，可再强化其基层经验价值。",
    "韩啸和董事会甩锅派的压迫感在开场有效，但中段后几乎消失。既然本章卖点之一是‘最不利局面’，建议在现场过程中穿插来自总部的催逼、媒体电话、会议追责升级消息，让双线压力持续存在。",
    "章节标题强调‘锅已经扣下来，人得先救出来’，正文前半兑现很好，后半更偏技术排查。调查推进合理，但可稍压缩抒情句和重复表意，把更多篇幅留给‘救人救单’与‘总部追责并行’的张力。",
    "个别表达略有重复，如‘先把人从锅里捞出来’‘锅已经扣下来了’‘不是脱身，是掌舵/握方向盘’同章内反复出现，虽然有主题强化效果，但略显刻意。",
    "结尾钩子有效，但与章节计划中的‘被删除的操作日志备份里藏着郑维与外部IP异常连接’相比，当前只到‘异常外部连接介入过调度权限’，还差一点更具指向性的实证感。若下一章承接要更猛，本章结尾可再明确一点“连接来源可疑但尚未坐实归属”。"
  ],
  "rewrite_instruction": "保留本章总体结构与核心选择，不要重写剧情方向，做一轮强化型修订：1）在陆川决定离开解释会前，补一个更具体的制度代价或即时后果，例如韩啸明确表示缺席将形成书面问责、暂停权限或对外定性，让‘逆向决定’更有重量；2）强化苏蔓转向支持的触发过程，增加她在站点或商户现场看到真实损失、意识到总部口径会继续碾压一线后的心理落点，再进入她决定冒程序风险协助；3）把‘冻结扣罚’补成更可信的执行动作，例如苏蔓现场发临时留痕、站点群通知、要求财务/人资挂起结算，避免只靠口头承诺；4）在现场止血段加入一到两笔总部持续施压的信息打断，如董事会催返、媒体堵口、韩啸要求统一口径，维持“内外夹击”感；5）技术排查部分增加一点阻力，不要让何小满查得太顺，可写日志被覆盖、权限层级受限、备份延迟、只能先拿到残缺证据，增强真实感；6）给老周补一个体现老站长专业判断的动作，不只是摇人，可让他指出某条巷线、某类单型、某批骑手情绪风险，从而与陆川形成互补；7）压缩同义反复的主题句，减少‘锅/掌舵/脱身’的重复表述，把篇幅让给具体执行细节；8）结尾钩子再明确半步：保留未坐实状态，但提示该外部连接具有可追踪来源或异常登录特征，为下一章深挖内外勾连提供更强牵引。"
}