{
  "chapter_index": 6,
  "logic_score": 88,
  "character_score": 91,
  "pace_score": 90,
  "information_score": 89,
  "emotion_score": 92,
  "style_score": 93,
  "hook_score": 90,
  "total_score": 90,
  "major_conflict": false,
  "needs_rewrite": true,
  "needs_manual_review": false,
  "problems": [
    "章节整体完成度高，基本达成了从总部口径转向基层人心的功能目标，但仍有几处执行层逻辑不够扎实。",
    "苏蔓在车上仍用“短时波动、拒单率上升四点二、履约”这类总部口径说话是对的，但她作为法务/董秘型角色，进入站点后功能偏弱，除了吐槽和记录，没有体现她对程序、证据、后续追责链条的敏感度，角色辨识度略降。",
    "赵姐在本章登场有效，但出现略显方便：她像是为了把商户压力具象化而及时闯入，缺少一笔前置交代，例如她本就在门口堵人或刚接到站点解释失败的承接，会让出场更自然。",
    "“同一笔异常订单，一单三次落账”是很强的信息点，但目前只靠纸面翻阅得出，缺少一笔更明确的解释：三次分别以什么名目进入哪个责任口径，否则容易显得过于戏剧化，读者可能质疑是否真能这么粗暴重复扣。",
    "陆川当场提出“异常错派人工挑出来、超时争议单现场登记、商户催单站点统一回”是对的，但这些动作如何在当晚立刻执行，缺少一个更细的落地点，例如谁负责筛单、谁负责登记、谁去对商户，导致止血方案略停在口头层面。",
    "老周的对抗感立住了，但还可以再增加一笔他本人真实损失或站点账面压力，使他不仅是基层代言人，更是有切身账目痛感的站长，这样更厚。",
    "章节多次高质量重复了“总部拿一线填报表窟窿”的核心表达，情绪有力，但语义略有复沓，个别段落可压缩，换取更多现场操作细节。",
    "结尾钩子是有效的，但与章节计划中的“当众摘下工牌说今晚单子我跟你们一起送，赔付账现场算”几乎完全重合，惊喜度更偏执行兑现，缺少一点额外升级信息，例如当夜第一批最棘手单已经压进来。"
  ],
  "rewrite_instruction": "保留本章整体结构、主要情绪和结尾动作，不要重写方向，只做增强型修订。第一，补强赔付链条逻辑：把“一单三次落账”具体写清为用户赔付、商户补偿、骑手/站点考核分别如何形成，避免只靠情绪判断成立。第二，补强现场止血方案的可执行性：让陆川在扔工牌后明确分工，例如老周盯运力、副站长筛异常错派、苏蔓负责留存截图和登记争议单、赵姐去压商户情绪，这样行动承诺才不是空口。第三，给苏蔓增加一笔符合其人设的有效动作或判断，比如她意识到这些单据可作为追责证据、提醒保留后台时间戳，强化她“懂规则和程序”的价值。第四，优化赵姐出场衔接，加一两句前置承接，让她不是纯功能性闯入。第五，删掉两处意思重复的“总部拿一线填报表窟窿/不是单量大是乱派甩责”的表述，把篇幅换成更具体的现场细节。第六，结尾钩子后再补一小笔更紧的当夜压力，例如电子屏继续刷出跨区急单或第一单争议已经当场爆发，以强化下一章承接力。"
}